{
  "schema_version": "0.1.0",
  "projeto": {
    "nome": "Cozinha simples (exemplo)",
    "unidade": "mm",
    "calibracao": {
      "ponto_a": {
        "x": 0,
        "y": 0
      },
      "ponto_b": {
        "x": 4000,
        "y": 0
      },
      "medida_mm": 4000,
      "origem": "usuario"
    },
    "tolerancia_mm": 10
  },
  "fonte": {
    "tipo": "dxf",
    "arquivo": "cozinha-planta.dxf",
    "arquivo_corte": "cozinha-corte.dxf",
    "confianca_global": 0.95
  },
  "pavimentos": [
    {
      "id": "terreo",
      "nome": "Térreo",
      "cota_piso_mm": 0,
      "pe_direito_mm": 2700,
      "paredes": [
        {
          "id": "p_sul",
          "inicio": {
            "x": 0,
            "y": 0
          },
          "fim": {
            "x": 4000,
            "y": 0
          },
          "espessura_mm": 150,
          "eixo": "centro",
          "origem": "medida",
          "confianca": 0.98
        },
        {
          "id": "p_leste",
          "inicio": {
            "x": 4000,
            "y": 0
          },
          "fim": {
            "x": 4000,
            "y": 3000
          },
          "espessura_mm": 150,
          "eixo": "centro",
          "origem": "medida",
          "confianca": 0.98
        },
        {
          "id": "p_norte",
          "inicio": {
            "x": 4000,
            "y": 3000
          },
          "fim": {
            "x": 0,
            "y": 3000
          },
          "espessura_mm": 150,
          "eixo": "centro",
          "origem": "medida",
          "confianca": 0.98
        },
        {
          "id": "p_oeste",
          "inicio": {
            "x": 0,
            "y": 3000
          },
          "fim": {
            "x": 0,
            "y": 0
          },
          "espessura_mm": 150,
          "eixo": "centro",
          "origem": "medida",
          "confianca": 0.98
        }
      ],
      "aberturas": [
        {
          "id": "porta_entrada",
          "tipo": "porta",
          "parede_id": "p_sul",
          "posicao_mm": 500,
          "largura_mm": 800,
          "altura_mm": 2100,
          "peitoril_mm": 0,
          "sentido_abertura": "interno",
          "origem": "medida",
          "confianca": 0.9
        },
        {
          "id": "janela_leste",
          "tipo": "janela",
          "parede_id": "p_leste",
          "posicao_mm": 900,
          "largura_mm": 1200,
          "altura_mm": 1000,
          "peitoril_mm": 1100,
          "sentido_abertura": "correr",
          "origem": "medida",
          "confianca": 0.9
        }
      ],
      "ambientes": [
        {
          "id": "cozinha",
          "nome": "Cozinha",
          "paredes_ids": [
            "p_sul",
            "p_leste",
            "p_norte",
            "p_oeste"
          ],
          "area_declarada_m2": 10.97
        }
      ],
      "mobiliario": [
        {
          "id": "balcao_pia",
          "bloco": {
            "catalogo": "demo",
            "id": "balcao_2_portas",
            "versao": 1
          },
          "ambiente_id": "cozinha",
          "apoio": {
            "parede_id": "p_norte",
            "distancia_do_inicio_mm": 600,
            "afastamento_mm": 0,
            "elevacao_mm": 0
          },
          "parametros": {
            "largura_mm": 1200,
            "altura_mm": 870,
            "profundidade_mm": 600,
            "portas": 2,
            "espessura_chapa_mm": 18,
            "socalo_mm": 100
          }
        },
        {
          "id": "gaveteiro_pia",
          "bloco": {
            "catalogo": "demo",
            "id": "gaveteiro_3_gavetas",
            "versao": 1
          },
          "ambiente_id": "cozinha",
          "apoio": {
            "parede_id": "p_norte",
            "distancia_do_inicio_mm": 1800,
            "afastamento_mm": 0,
            "elevacao_mm": 0
          },
          "parametros": {
            "largura_mm": 600,
            "altura_mm": 870,
            "profundidade_mm": 600,
            "gavetas": 3,
            "espessura_chapa_mm": 18,
            "socalo_mm": 100
          }
        },
        {
          "id": "aereo_pia",
          "bloco": {
            "catalogo": "demo",
            "id": "aereo_2_portas",
            "versao": 1
          },
          "ambiente_id": "cozinha",
          "apoio": {
            "parede_id": "p_norte",
            "distancia_do_inicio_mm": 600,
            "afastamento_mm": 0,
            "elevacao_mm": 1400
          },
          "parametros": {
            "largura_mm": 1200,
            "altura_mm": 700,
            "profundidade_mm": 330,
            "portas": 2,
            "espessura_chapa_mm": 15
          }
        }
      ],
      "acabamentos": [
        {
          "id": "acab_balcao_portas",
          "alvo": {
            "tipo": "movel_peca",
            "id": "balcao_pia",
            "peca": "porta"
          },
          "textura": {
            "catalogo": "demo",
            "id": "mdf_verde",
            "versao": 1
          },
          "escala_amostra_mm": 2750,
          "rotacao_veio_graus": 90
        }
      ]
    }
  ],
  "vistas": [
    {
      "id": "v_planta",
      "tipo": "planta",
      "pavimento_id": "terreo",
      "escala": "1:50",
      "formato": "png"
    },
    {
      "id": "v_frontal",
      "tipo": "frontal",
      "pavimento_id": "terreo",
      "escala": "1:50",
      "formato": "png"
    },
    {
      "id": "v_fundos",
      "tipo": "fundos",
      "pavimento_id": "terreo",
      "escala": "1:50",
      "formato": "png"
    },
    {
      "id": "v_esquerda",
      "tipo": "lateral_esquerda",
      "pavimento_id": "terreo",
      "escala": "1:50",
      "formato": "png"
    },
    {
      "id": "v_direita",
      "tipo": "lateral_direita",
      "pavimento_id": "terreo",
      "escala": "1:50",
      "formato": "png"
    }
  ],
  "historico_ajustes": []
}
